0.000000 0.000000 IP 192.168.11.202.56790 > 192.168.11.214.1234: Flags [S], seq 1462186260, win 64240, options [mss 1460,sackOK,TS val 1406123327 ecr 0,nop,wscale 7], length 0
0.000053 0.000053 IP 192.168.11.214.1234 > 192.168.11.202.56790: Flags [S.], seq 169596172, ack 1462186261, win 65160, options [mss 1460,sackOK,TS val 2255334713 ecr 1406123327,nop,wscale 7], length 0
0.000070 0.000017 IP 192.168.11.202.56790 > 192.168.11.214.1234: Flags [.], ack 1, win 502, options [nop,nop,TS val 1406123327 ecr 2255334713], length 0
0.000083 0.000013 IP 192.168.11.202.56790 > 192.168.11.214.1234: Flags [P.], seq 1:513, ack 1, win 502, options [nop,nop,TS val 1406123327 ecr 2255334713], length 512
0.000103 0.000020 client: wrote 1st request data
0.000116 0.000013 IP 192.168.11.214.1234 > 192.168.11.202.56790: Flags [.], ack 513, win 506, options [nop,nop,TS val 2255334713 ecr 1406123327], length 0
0.000147 0.000031 IP 192.168.11.202.56790 > 192.168.11.214.1234: Flags [P.], seq 513:1025, ack 1, win 502, options [nop,nop,TS val 1406123327 ecr 2255334713], length 512
0.000150 0.000003 client: wrote 2nd data
0.000182 0.000032 IP 192.168.11.214.1234 > 192.168.11.202.56790: Flags [.], ack 1025, win 502, options [nop,nop,TS val 2255334713 ecr 1406123327], length 0
0.000286 0.000104 IP 192.168.11.214.1234 > 192.168.11.202.56790: Flags [P.], seq 1:1449, ack 1025, win 502, options [nop,nop,TS val 2255334713 ecr 1406123327], length 1448
0.000291 0.000005 IP 192.168.11.202.56790 > 192.168.11.214.1234: Flags [.], ack 1449, win 501, options [nop,nop,TS val 1406123327 ecr 2255334713], length 0
0.000300 0.000009 client: got reply
1.000369 1.000069 IP 192.168.11.202.56790 > 192.168.11.214.1234: Flags [P.], seq 1025:1537, ack 1449, win 501, options [nop,nop,TS val 1406124327 ecr 2255334713], length 512
1.000374 0.000005 client: wrote 1st request data
1.000383 0.000009 client: wrote 2nd data
1.040412 0.040029 IP 192.168.11.214.1234 > 192.168.11.202.56790: Flags [.], ack 1537, win 501, options [nop,nop,TS val 2255335753 ecr 1406124327], length 0
1.040419 0.000007 IP 192.168.11.202.56790 > 192.168.11.214.1234: Flags [P.], seq 1537:2049, ack 1449, win 501, options [nop,nop,TS val 1406124367 ecr 2255335753], length 512
1.040451 0.000032 IP 192.168.11.214.1234 > 192.168.11.202.56790: Flags [.], ack 2049, win 501, options [nop,nop,TS val 2255335754 ecr 1406124367], length 0
1.040469 0.000018 IP 192.168.11.214.1234 > 192.168.11.202.56790: Flags [P.], seq 1449:2897, ack 2049, win 501, options [nop,nop,TS val 2255335754 ecr 1406124367], length 1448
1.040472 0.000003 IP 192.168.11.202.56790 > 192.168.11.214.1234: Flags [.], ack 2897, win 501, options [nop,nop,TS val 1406124367 ecr 2255335754], length 0
1.040477 0.000005 client: got reply
2.040544 1.000067 IP 192.168.11.202.56790 > 192.168.11.214.1234: Flags [P.], seq 2049:2561, ack 2897, win 501, options [nop,nop,TS val 1406125368 ecr 2255335754], length 512
2.040549 0.000005 client: wrote 1st request data
2.040559 0.000010 client: wrote 2nd data
2.081410 0.040851 IP 192.168.11.214.1234 > 192.168.11.202.56790: Flags [.], ack 2561, win 501, options [nop,nop,TS val 2255336794 ecr 1406125368], length 0
2.081416 0.000006 IP 192.168.11.202.56790 > 192.168.11.214.1234: Flags [P.], seq 2561:3073, ack 2897, win 501, options [nop,nop,TS val 1406125408 ecr 2255336794], length 512
2.081448 0.000032 IP 192.168.11.214.1234 > 192.168.11.202.56790: Flags [.], ack 3073, win 501, options [nop,nop,TS val 2255336795 ecr 1406125408], length 0
2.081460 0.000012 IP 192.168.11.214.1234 > 192.168.11.202.56790: Flags [P.], seq 2897:4345, ack 3073, win 501, options [nop,nop,TS val 2255336795 ecr 1406125408], length 1448
2.081464 0.000004 IP 192.168.11.202.56790 > 192.168.11.214.1234: Flags [.], ack 4345, win 501, options [nop,nop,TS val 1406125408 ecr 2255336795], length 0
2.081469 0.000005 client: got reply
3.081538 1.000069 IP 192.168.11.202.56790 > 192.168.11.214.1234: Flags [P.], seq 3073:3585, ack 4345, win 501, options [nop,nop,TS val 1406126409 ecr 2255336795], length 512
3.081543 0.000005 client: wrote 1st request data
3.081552 0.000009 client: wrote 2nd data
3.122410 0.040858 IP 192.168.11.214.1234 > 192.168.11.202.56790: Flags [.], ack 3585, win 501, options [nop,nop,TS val 2255337835 ecr 1406126409], length 0
3.122421 0.000011 IP 192.168.11.202.56790 > 192.168.11.214.1234: Flags [P.], seq 3585:4097, ack 4345, win 501, options [nop,nop,TS val 1406126449 ecr 2255337835], length 512
3.122454 0.000033 IP 192.168.11.214.1234 > 192.168.11.202.56790: Flags [.], ack 4097, win 501, options [nop,nop,TS val 2255337836 ecr 1406126449], length 0
3.122466 0.000012 IP 192.168.11.214.1234 > 192.168.11.202.56790: Flags [P.], seq 4345:5793, ack 4097, win 501, options [nop,nop,TS val 2255337836 ecr 1406126449], length 1448
3.122472 0.000006 IP 192.168.11.202.56790 > 192.168.11.214.1234: Flags [.], ack 5793, win 501, options [nop,nop,TS val 1406126449 ecr 2255337836], length 0
3.122476 0.000004 client: got reply
4.122543 1.000067 IP 192.168.11.202.56790 > 192.168.11.214.1234: Flags [P.], seq 4097:4609, ack 5793, win 501, options [nop,nop,TS val 1406127450 ecr 2255337836], length 512
4.122547 0.000004 client: wrote 1st request data
4.122553 0.000006 client: wrote 2nd data
4.163413 0.040860 IP 192.168.11.214.1234 > 192.168.11.202.56790: Flags [.], ack 4609, win 501, options [nop,nop,TS val 2255338876 ecr 1406127450], length 0
4.163423 0.000010 IP 192.168.11.202.56790 > 192.168.11.214.1234: Flags [P.], seq 4609:5121, ack 5793, win 501, options [nop,nop,TS val 1406127490 ecr 2255338876], length 512
4.163457 0.000034 IP 192.168.11.214.1234 > 192.168.11.202.56790: Flags [.], ack 5121, win 501, options [nop,nop,TS val 2255338877 ecr 1406127490], length 0
4.163470 0.000013 IP 192.168.11.214.1234 > 192.168.11.202.56790: Flags [P.], seq 5793:7241, ack 5121, win 501, options [nop,nop,TS val 2255338877 ecr 1406127490], length 1448
4.163475 0.000005 IP 192.168.11.202.56790 > 192.168.11.214.1234: Flags [.], ack 7241, win 501, options [nop,nop,TS val 1406127490 ecr 2255338877], length 0
4.163479 0.000004 client: got reply
5.099559 0.936080 IP 192.168.11.202.56790 > 192.168.11.214.1234: Flags [F.], seq 5121, ack 7241, win 501, options [nop,nop,TS val 1406128427 ecr 2255338877], length 0
5.099640 0.000081 IP 192.168.11.214.1234 > 192.168.11.202.56790: Flags [F.], seq 7241, ack 5122, win 501, options [nop,nop,TS val 2255339813 ecr 1406128427], length 0
5.099652 0.000012 IP 192.168.11.202.56790 > 192.168.11.214.1234: Flags [.], ack 7242, win 501, options [nop,nop,TS val 1406128427 ecr 2255339813], length 0
