     1  0.000000 0.000000 IP 192.168.10.202.37354 > 192.168.10.214.1234: Flags [S], seq 2602696341, win 64240, options [mss 1460,sackOK,TS val 3992174079 ecr 0,nop,wscale 7], length 0
     2  0.000053 0.000053 IP 192.168.10.214.1234 > 192.168.10.202.37354: Flags [S.], seq 2537954765, ack 2602696342, win 65160, options [mss 1460,sackOK,TS val 2940487687 ecr 3992174079,nop,wscale 7], length 0
     3  0.000073 0.000020 IP 192.168.10.202.37354 > 192.168.10.214.1234: Flags [.], ack 1, win 502, options [nop,nop,TS val 3992174080 ecr 2940487687], length 0
     4  0.000094 0.000021 client: will write header
     5  0.000141 0.000047 IP 192.168.10.202.37354 > 192.168.10.214.1234: Flags [P.], seq 1:513, ack 1, win 502, options [nop,nop,TS val 3992174080 ecr 2940487687], length 512
     6  0.000145 0.000004 client: wrote header
     7  0.000149 0.000004 client: will write body
     8  0.000152 0.000003 client: wrote body
     9  0.000153 0.000001 client: will read reply
    10  0.000179 0.000026 IP 192.168.10.214.1234 > 192.168.10.202.37354: Flags [.], ack 513, win 506, options [nop,nop,TS val 2940487687 ecr 3992174080], length 0
    11  0.000184 0.000005 IP 192.168.10.202.37354 > 192.168.10.214.1234: Flags [P.], seq 513:1025, ack 1, win 502, options [nop,nop,TS val 3992174080 ecr 2940487687], length 512
    12  0.000215 0.000031 IP 192.168.10.214.1234 > 192.168.10.202.37354: Flags [.], ack 1025, win 502, options [nop,nop,TS val 2940487687 ecr 3992174080], length 0
    13  0.000312 0.000097 IP 192.168.10.214.1234 > 192.168.10.202.37354: Flags [P.], seq 1:1449, ack 1025, win 502, options [nop,nop,TS val 2940487687 ecr 3992174080], length 1448
    14  0.000316 0.000004 IP 192.168.10.202.37354 > 192.168.10.214.1234: Flags [.], ack 1449, win 501, options [nop,nop,TS val 3992174080 ecr 2940487687], length 0
    15  0.000321 0.000005 client: got reply
    16  1.000384 1.000063 client: will write header
    17  1.000398 0.000014 IP 192.168.10.202.37354 > 192.168.10.214.1234: Flags [P.], seq 1025:1537, ack 1449, win 501, options [nop,nop,TS val 3992175080 ecr 2940487687], length 512
    18  1.000402 0.000004 client: wrote header
    19  1.000405 0.000003 client: will write body
    20  1.000408 0.000003 client: wrote body
    21  1.000410 0.000002 client: will read reply
    22  1.040939 0.040529 IP 192.168.10.214.1234 > 192.168.10.202.37354: Flags [.], ack 1537, win 501, options [nop,nop,TS val 2940488727 ecr 3992175080], length 0
    23  1.040945 0.000006 IP 192.168.10.202.37354 > 192.168.10.214.1234: Flags [P.], seq 1537:2049, ack 1449, win 501, options [nop,nop,TS val 3992175120 ecr 2940488727], length 512
    24  1.040977 0.000032 IP 192.168.10.214.1234 > 192.168.10.202.37354: Flags [.], ack 2049, win 501, options [nop,nop,TS val 2940488728 ecr 3992175120], length 0
    25  1.040990 0.000013 IP 192.168.10.214.1234 > 192.168.10.202.37354: Flags [P.], seq 1449:2897, ack 2049, win 501, options [nop,nop,TS val 2940488728 ecr 3992175120], length 1448
    26  1.040994 0.000004 IP 192.168.10.202.37354 > 192.168.10.214.1234: Flags [.], ack 2897, win 501, options [nop,nop,TS val 3992175120 ecr 2940488728], length 0
    27  1.040998 0.000004 client: got reply
    28  2.041059 1.000061 client: will write header
    29  2.041071 0.000012 IP 192.168.10.202.37354 > 192.168.10.214.1234: Flags [P.], seq 2049:2561, ack 2897, win 501, options [nop,nop,TS val 3992176121 ecr 2940488728], length 512
    30  2.041075 0.000004 client: wrote header
    31  2.041078 0.000003 client: will write body
    32  2.041080 0.000002 client: wrote body
    33  2.041082 0.000002 client: will read reply
    34  2.081936 0.040854 IP 192.168.10.214.1234 > 192.168.10.202.37354: Flags [.], ack 2561, win 501, options [nop,nop,TS val 2940489768 ecr 3992176121], length 0
    35  2.081944 0.000008 IP 192.168.10.202.37354 > 192.168.10.214.1234: Flags [P.], seq 2561:3073, ack 2897, win 501, options [nop,nop,TS val 3992176161 ecr 2940489768], length 512
    36  2.081976 0.000032 IP 192.168.10.214.1234 > 192.168.10.202.37354: Flags [.], ack 3073, win 501, options [nop,nop,TS val 2940489769 ecr 3992176161], length 0
    37  2.081987 0.000011 IP 192.168.10.214.1234 > 192.168.10.202.37354: Flags [P.], seq 2897:4345, ack 3073, win 501, options [nop,nop,TS val 2940489769 ecr 3992176161], length 1448
    38  2.081991 0.000004 IP 192.168.10.202.37354 > 192.168.10.214.1234: Flags [.], ack 4345, win 501, options [nop,nop,TS val 3992176161 ecr 2940489769], length 0
    39  2.081995 0.000004 client: got reply
    40  3.082056 1.000061 client: will write header
    41  3.082068 0.000012 IP 192.168.10.202.37354 > 192.168.10.214.1234: Flags [P.], seq 3073:3585, ack 4345, win 501, options [nop,nop,TS val 3992177162 ecr 2940489769], length 512
    42  3.082071 0.000003 client: wrote header
    43  3.082074 0.000003 client: will write body
    44  3.082077 0.000003 client: wrote body
    45  3.082078 0.000001 client: will read reply
    46  3.122937 0.040859 IP 192.168.10.214.1234 > 192.168.10.202.37354: Flags [.], ack 3585, win 501, options [nop,nop,TS val 2940490809 ecr 3992177162], length 0
    47  3.122942 0.000005 IP 192.168.10.202.37354 > 192.168.10.214.1234: Flags [P.], seq 3585:4097, ack 4345, win 501, options [nop,nop,TS val 3992177202 ecr 2940490809], length 512
    48  3.122973 0.000031 IP 192.168.10.214.1234 > 192.168.10.202.37354: Flags [.], ack 4097, win 501, options [nop,nop,TS val 2940490810 ecr 3992177202], length 0
    49  3.122986 0.000013 IP 192.168.10.214.1234 > 192.168.10.202.37354: Flags [P.], seq 4345:5793, ack 4097, win 501, options [nop,nop,TS val 2940490810 ecr 3992177202], length 1448
    50  3.122989 0.000003 IP 192.168.10.202.37354 > 192.168.10.214.1234: Flags [.], ack 5793, win 501, options [nop,nop,TS val 3992177202 ecr 2940490810], length 0
    51  3.122994 0.000005 client: got reply
    52  4.123054 1.000060 client: will write header
    53  4.123067 0.000013 IP 192.168.10.202.37354 > 192.168.10.214.1234: Flags [P.], seq 4097:4609, ack 5793, win 501, options [nop,nop,TS val 3992178203 ecr 2940490810], length 512
    54  4.123070 0.000003 client: wrote header
    55  4.123073 0.000003 client: will write body
    56  4.123076 0.000003 client: wrote body
    57  4.123078 0.000002 client: will read reply
    58  4.163936 0.040858 IP 192.168.10.214.1234 > 192.168.10.202.37354: Flags [.], ack 4609, win 501, options [nop,nop,TS val 2940491850 ecr 3992178203], length 0
    59  4.163941 0.000005 IP 192.168.10.202.37354 > 192.168.10.214.1234: Flags [P.], seq 4609:5121, ack 5793, win 501, options [nop,nop,TS val 3992178243 ecr 2940491850], length 512
    60  4.163973 0.000032 IP 192.168.10.214.1234 > 192.168.10.202.37354: Flags [.], ack 5121, win 501, options [nop,nop,TS val 2940491851 ecr 3992178243], length 0
    61  4.163984 0.000011 IP 192.168.10.214.1234 > 192.168.10.202.37354: Flags [P.], seq 5793:7241, ack 5121, win 501, options [nop,nop,TS val 2940491851 ecr 3992178243], length 1448
    62  4.163987 0.000003 IP 192.168.10.202.37354 > 192.168.10.214.1234: Flags [.], ack 7241, win 501, options [nop,nop,TS val 3992178243 ecr 2940491851], length 0
    63  4.163992 0.000005 client: got reply
    64  5.164052 1.000060 client: will write header
    65  5.164064 0.000012 IP 192.168.10.202.37354 > 192.168.10.214.1234: Flags [P.], seq 5121:5633, ack 7241, win 501, options [nop,nop,TS val 3992179244 ecr 2940491851], length 512
    66  5.164067 0.000003 client: wrote header
    67  5.164070 0.000003 client: will write body
    68  5.164073 0.000003 client: wrote body
    69  5.164074 0.000001 client: will read reply
    70  5.204935 0.040861 IP 192.168.10.214.1234 > 192.168.10.202.37354: Flags [.], ack 5633, win 501, options [nop,nop,TS val 2940492891 ecr 3992179244], length 0
    71  5.204940 0.000005 IP 192.168.10.202.37354 > 192.168.10.214.1234: Flags [P.], seq 5633:6145, ack 7241, win 501, options [nop,nop,TS val 3992179284 ecr 2940492891], length 512
    72  5.204971 0.000031 IP 192.168.10.214.1234 > 192.168.10.202.37354: Flags [.], ack 6145, win 501, options [nop,nop,TS val 2940492892 ecr 3992179284], length 0
    73  5.204983 0.000012 IP 192.168.10.214.1234 > 192.168.10.202.37354: Flags [P.], seq 7241:8689, ack 6145, win 501, options [nop,nop,TS val 2940492892 ecr 3992179284], length 1448
    74  5.204986 0.000003 IP 192.168.10.202.37354 > 192.168.10.214.1234: Flags [.], ack 8689, win 501, options [nop,nop,TS val 3992179284 ecr 2940492892], length 0
    75  5.204991 0.000005 client: got reply
    76  6.205050 1.000059 client: will write header
    77  6.205062 0.000012 IP 192.168.10.202.37354 > 192.168.10.214.1234: Flags [P.], seq 6145:6657, ack 8689, win 501, options [nop,nop,TS val 3992180285 ecr 2940492892], length 512
    78  6.205065 0.000003 client: wrote header
    79  6.205068 0.000003 client: will write body
    80  6.205070 0.000002 client: wrote body
    81  6.205072 0.000002 client: will read reply
    82  6.245944 0.040872 IP 192.168.10.214.1234 > 192.168.10.202.37354: Flags [.], ack 6657, win 501, options [nop,nop,TS val 2940493932 ecr 3992180285], length 0
    83  6.245949 0.000005 IP 192.168.10.202.37354 > 192.168.10.214.1234: Flags [P.], seq 6657:7169, ack 8689, win 501, options [nop,nop,TS val 3992180325 ecr 2940493932], length 512
    84  6.245981 0.000032 IP 192.168.10.214.1234 > 192.168.10.202.37354: Flags [.], ack 7169, win 501, options [nop,nop,TS val 2940493933 ecr 3992180325], length 0
    85  6.245991 0.000010 IP 192.168.10.214.1234 > 192.168.10.202.37354: Flags [P.], seq 8689:10137, ack 7169, win 501, options [nop,nop,TS val 2940493933 ecr 3992180325], length 1448
    86  6.245995 0.000004 IP 192.168.10.202.37354 > 192.168.10.214.1234: Flags [.], ack 10137, win 501, options [nop,nop,TS val 3992180325 ecr 2940493933], length 0
    87  6.245999 0.000004 client: got reply
    88  7.246060 1.000061 client: will write header
    89  7.246071 0.000011 IP 192.168.10.202.37354 > 192.168.10.214.1234: Flags [P.], seq 7169:7681, ack 10137, win 501, options [nop,nop,TS val 3992181326 ecr 2940493933], length 512
    90  7.246074 0.000003 client: wrote header
    91  7.246077 0.000003 client: will write body
    92  7.246079 0.000002 client: wrote body
    93  7.246081 0.000002 client: will read reply
    94  7.286936 0.040855 IP 192.168.10.214.1234 > 192.168.10.202.37354: Flags [.], ack 7681, win 501, options [nop,nop,TS val 2940494973 ecr 3992181326], length 0
    95  7.286941 0.000005 IP 192.168.10.202.37354 > 192.168.10.214.1234: Flags [P.], seq 7681:8193, ack 10137, win 501, options [nop,nop,TS val 3992181366 ecr 2940494973], length 512
    96  7.286973 0.000032 IP 192.168.10.214.1234 > 192.168.10.202.37354: Flags [.], ack 8193, win 501, options [nop,nop,TS val 2940494974 ecr 3992181366], length 0
    97  7.286984 0.000011 IP 192.168.10.214.1234 > 192.168.10.202.37354: Flags [P.], seq 10137:11585, ack 8193, win 501, options [nop,nop,TS val 2940494974 ecr 3992181366], length 1448
    98  7.286987 0.000003 IP 192.168.10.202.37354 > 192.168.10.214.1234: Flags [.], ack 11585, win 501, options [nop,nop,TS val 3992181366 ecr 2940494974], length 0
    99  7.286992 0.000005 client: got reply
   100  8.287053 1.000061 client: will write header
   101  8.287065 0.000012 IP 192.168.10.202.37354 > 192.168.10.214.1234: Flags [P.], seq 8193:8705, ack 11585, win 501, options [nop,nop,TS val 3992182367 ecr 2940494974], length 512
   102  8.287068 0.000003 client: wrote header
   103  8.287071 0.000003 client: will write body
   104  8.287074 0.000003 client: wrote body
   105  8.287076 0.000002 client: will read reply
   106  8.327936 0.040860 IP 192.168.10.214.1234 > 192.168.10.202.37354: Flags [.], ack 8705, win 501, options [nop,nop,TS val 2940496014 ecr 3992182367], length 0
   107  8.327940 0.000004 IP 192.168.10.202.37354 > 192.168.10.214.1234: Flags [P.], seq 8705:9217, ack 11585, win 501, options [nop,nop,TS val 3992182407 ecr 2940496014], length 512
   108  8.327971 0.000031 IP 192.168.10.214.1234 > 192.168.10.202.37354: Flags [.], ack 9217, win 501, options [nop,nop,TS val 2940496015 ecr 3992182407], length 0
   109  8.327983 0.000012 IP 192.168.10.214.1234 > 192.168.10.202.37354: Flags [P.], seq 11585:13033, ack 9217, win 501, options [nop,nop,TS val 2940496015 ecr 3992182407], length 1448
   110  8.327986 0.000003 IP 192.168.10.202.37354 > 192.168.10.214.1234: Flags [.], ack 13033, win 501, options [nop,nop,TS val 3992182407 ecr 2940496015], length 0
   111  8.327991 0.000005 client: got reply
   112  9.328053 1.000062 client: will write header
   113  9.328064 0.000011 IP 192.168.10.202.37354 > 192.168.10.214.1234: Flags [P.], seq 9217:9729, ack 13033, win 501, options [nop,nop,TS val 3992183408 ecr 2940496015], length 512
   114  9.328068 0.000004 client: wrote header
   115  9.328070 0.000002 client: will write body
   116  9.328073 0.000003 client: wrote body
   117  9.328075 0.000002 client: will read reply
   118  9.368935 0.040860 IP 192.168.10.214.1234 > 192.168.10.202.37354: Flags [.], ack 9729, win 501, options [nop,nop,TS val 2940497055 ecr 3992183408], length 0
   119  9.368939 0.000004 IP 192.168.10.202.37354 > 192.168.10.214.1234: Flags [P.], seq 9729:10241, ack 13033, win 501, options [nop,nop,TS val 3992183448 ecr 2940497055], length 512
   120  9.368971 0.000032 IP 192.168.10.214.1234 > 192.168.10.202.37354: Flags [.], ack 10241, win 501, options [nop,nop,TS val 2940497056 ecr 3992183448], length 0
   121  9.368985 0.000014 IP 192.168.10.214.1234 > 192.168.10.202.37354: Flags [P.], seq 13033:14481, ack 10241, win 501, options [nop,nop,TS val 2940497056 ecr 3992183448], length 1448
   122  9.368993 0.000008 IP 192.168.10.202.37354 > 192.168.10.214.1234: Flags [.], ack 14481, win 501, options [nop,nop,TS val 3992183448 ecr 2940497056], length 0
   123  9.368998 0.000005 client: got reply
   124  10.099569 0.730571 IP 192.168.10.202.37354 > 192.168.10.214.1234: Flags [F.], seq 10241, ack 14481, win 501, options [nop,nop,TS val 3992184179 ecr 2940497056], length 0
   125  10.099658 0.000089 IP 192.168.10.214.1234 > 192.168.10.202.37354: Flags [F.], seq 14481, ack 10242, win 501, options [nop,nop,TS val 2940497786 ecr 3992184179], length 0
   126  10.099669 0.000011 IP 192.168.10.202.37354 > 192.168.10.214.1234: Flags [.], ack 14482, win 501, options [nop,nop,TS val 3992184179 ecr 2940497786], length 0
