     1  0.000000 0.000000 IP 192.168.10.202.37354 > 192.168.10.214.1234: Flags [S], seq 2602696341, win 64240, options [mss 1460,sackOK,TS val 3992174079 ecr 0,nop,wscale 7], length 0
     2  0.000053 0.000053 IP 192.168.10.214.1234 > 192.168.10.202.37354: Flags [S.], seq 2537954765, ack 2602696342, win 65160, options [mss 1460,sackOK,TS val 2940487687 ecr 3992174079,nop,wscale 7], length 0
     3  0.000073 0.000020 IP 192.168.10.202.37354 > 192.168.10.214.1234: Flags [.], ack 1, win 502, options [nop,nop,TS val 3992174080 ecr 2940487687], length 0
     4  0.000141 0.000068 IP 192.168.10.202.37354 > 192.168.10.214.1234: Flags [P.], seq 1:513, ack 1, win 502, options [nop,nop,TS val 3992174080 ecr 2940487687], length 512
     5  0.000179 0.000038 IP 192.168.10.214.1234 > 192.168.10.202.37354: Flags [.], ack 513, win 506, options [nop,nop,TS val 2940487687 ecr 3992174080], length 0
     6  0.000184 0.000005 IP 192.168.10.202.37354 > 192.168.10.214.1234: Flags [P.], seq 513:1025, ack 1, win 502, options [nop,nop,TS val 3992174080 ecr 2940487687], length 512
     7  0.000215 0.000031 IP 192.168.10.214.1234 > 192.168.10.202.37354: Flags [.], ack 1025, win 502, options [nop,nop,TS val 2940487687 ecr 3992174080], length 0
     8  0.000312 0.000097 IP 192.168.10.214.1234 > 192.168.10.202.37354: Flags [P.], seq 1:1449, ack 1025, win 502, options [nop,nop,TS val 2940487687 ecr 3992174080], length 1448
     9  0.000316 0.000004 IP 192.168.10.202.37354 > 192.168.10.214.1234: Flags [.], ack 1449, win 501, options [nop,nop,TS val 3992174080 ecr 2940487687], length 0
    10  1.000398 1.000082 IP 192.168.10.202.37354 > 192.168.10.214.1234: Flags [P.], seq 1025:1537, ack 1449, win 501, options [nop,nop,TS val 3992175080 ecr 2940487687], length 512
    11  1.040939 0.040541 IP 192.168.10.214.1234 > 192.168.10.202.37354: Flags [.], ack 1537, win 501, options [nop,nop,TS val 2940488727 ecr 3992175080], length 0
    12  1.040945 0.000006 IP 192.168.10.202.37354 > 192.168.10.214.1234: Flags [P.], seq 1537:2049, ack 1449, win 501, options [nop,nop,TS val 3992175120 ecr 2940488727], length 512
    13  1.040977 0.000032 IP 192.168.10.214.1234 > 192.168.10.202.37354: Flags [.], ack 2049, win 501, options [nop,nop,TS val 2940488728 ecr 3992175120], length 0
    14  1.040990 0.000013 IP 192.168.10.214.1234 > 192.168.10.202.37354: Flags [P.], seq 1449:2897, ack 2049, win 501, options [nop,nop,TS val 2940488728 ecr 3992175120], length 1448
    15  1.040994 0.000004 IP 192.168.10.202.37354 > 192.168.10.214.1234: Flags [.], ack 2897, win 501, options [nop,nop,TS val 3992175120 ecr 2940488728], length 0
    16  2.041071 1.000077 IP 192.168.10.202.37354 > 192.168.10.214.1234: Flags [P.], seq 2049:2561, ack 2897, win 501, options [nop,nop,TS val 3992176121 ecr 2940488728], length 512
    17  2.081936 0.040865 IP 192.168.10.214.1234 > 192.168.10.202.37354: Flags [.], ack 2561, win 501, options [nop,nop,TS val 2940489768 ecr 3992176121], length 0
    18  2.081944 0.000008 IP 192.168.10.202.37354 > 192.168.10.214.1234: Flags [P.], seq 2561:3073, ack 2897, win 501, options [nop,nop,TS val 3992176161 ecr 2940489768], length 512
    19  2.081976 0.000032 IP 192.168.10.214.1234 > 192.168.10.202.37354: Flags [.], ack 3073, win 501, options [nop,nop,TS val 2940489769 ecr 3992176161], length 0
    20  2.081987 0.000011 IP 192.168.10.214.1234 > 192.168.10.202.37354: Flags [P.], seq 2897:4345, ack 3073, win 501, options [nop,nop,TS val 2940489769 ecr 3992176161], length 1448
    21  2.081991 0.000004 IP 192.168.10.202.37354 > 192.168.10.214.1234: Flags [.], ack 4345, win 501, options [nop,nop,TS val 3992176161 ecr 2940489769], length 0
    22  3.082068 1.000077 IP 192.168.10.202.37354 > 192.168.10.214.1234: Flags [P.], seq 3073:3585, ack 4345, win 501, options [nop,nop,TS val 3992177162 ecr 2940489769], length 512
    23  3.122937 0.040869 IP 192.168.10.214.1234 > 192.168.10.202.37354: Flags [.], ack 3585, win 501, options [nop,nop,TS val 2940490809 ecr 3992177162], length 0
    24  3.122942 0.000005 IP 192.168.10.202.37354 > 192.168.10.214.1234: Flags [P.], seq 3585:4097, ack 4345, win 501, options [nop,nop,TS val 3992177202 ecr 2940490809], length 512
    25  3.122973 0.000031 IP 192.168.10.214.1234 > 192.168.10.202.37354: Flags [.], ack 4097, win 501, options [nop,nop,TS val 2940490810 ecr 3992177202], length 0
    26  3.122986 0.000013 IP 192.168.10.214.1234 > 192.168.10.202.37354: Flags [P.], seq 4345:5793, ack 4097, win 501, options [nop,nop,TS val 2940490810 ecr 3992177202], length 1448
    27  3.122989 0.000003 IP 192.168.10.202.37354 > 192.168.10.214.1234: Flags [.], ack 5793, win 501, options [nop,nop,TS val 3992177202 ecr 2940490810], length 0
    28  4.123067 1.000078 IP 192.168.10.202.37354 > 192.168.10.214.1234: Flags [P.], seq 4097:4609, ack 5793, win 501, options [nop,nop,TS val 3992178203 ecr 2940490810], length 512
    29  4.163936 0.040869 IP 192.168.10.214.1234 > 192.168.10.202.37354: Flags [.], ack 4609, win 501, options [nop,nop,TS val 2940491850 ecr 3992178203], length 0
    30  4.163941 0.000005 IP 192.168.10.202.37354 > 192.168.10.214.1234: Flags [P.], seq 4609:5121, ack 5793, win 501, options [nop,nop,TS val 3992178243 ecr 2940491850], length 512
    31  4.163973 0.000032 IP 192.168.10.214.1234 > 192.168.10.202.37354: Flags [.], ack 5121, win 501, options [nop,nop,TS val 2940491851 ecr 3992178243], length 0
    32  4.163984 0.000011 IP 192.168.10.214.1234 > 192.168.10.202.37354: Flags [P.], seq 5793:7241, ack 5121, win 501, options [nop,nop,TS val 2940491851 ecr 3992178243], length 1448
    33  4.163987 0.000003 IP 192.168.10.202.37354 > 192.168.10.214.1234: Flags [.], ack 7241, win 501, options [nop,nop,TS val 3992178243 ecr 2940491851], length 0
    34  5.164064 1.000077 IP 192.168.10.202.37354 > 192.168.10.214.1234: Flags [P.], seq 5121:5633, ack 7241, win 501, options [nop,nop,TS val 3992179244 ecr 2940491851], length 512
    35  5.204935 0.040871 IP 192.168.10.214.1234 > 192.168.10.202.37354: Flags [.], ack 5633, win 501, options [nop,nop,TS val 2940492891 ecr 3992179244], length 0
    36  5.204940 0.000005 IP 192.168.10.202.37354 > 192.168.10.214.1234: Flags [P.], seq 5633:6145, ack 7241, win 501, options [nop,nop,TS val 3992179284 ecr 2940492891], length 512
    37  5.204971 0.000031 IP 192.168.10.214.1234 > 192.168.10.202.37354: Flags [.], ack 6145, win 501, options [nop,nop,TS val 2940492892 ecr 3992179284], length 0
    38  5.204983 0.000012 IP 192.168.10.214.1234 > 192.168.10.202.37354: Flags [P.], seq 7241:8689, ack 6145, win 501, options [nop,nop,TS val 2940492892 ecr 3992179284], length 1448
    39  5.204986 0.000003 IP 192.168.10.202.37354 > 192.168.10.214.1234: Flags [.], ack 8689, win 501, options [nop,nop,TS val 3992179284 ecr 2940492892], length 0
    40  6.205062 1.000076 IP 192.168.10.202.37354 > 192.168.10.214.1234: Flags [P.], seq 6145:6657, ack 8689, win 501, options [nop,nop,TS val 3992180285 ecr 2940492892], length 512
    41  6.245944 0.040882 IP 192.168.10.214.1234 > 192.168.10.202.37354: Flags [.], ack 6657, win 501, options [nop,nop,TS val 2940493932 ecr 3992180285], length 0
    42  6.245949 0.000005 IP 192.168.10.202.37354 > 192.168.10.214.1234: Flags [P.], seq 6657:7169, ack 8689, win 501, options [nop,nop,TS val 3992180325 ecr 2940493932], length 512
    43  6.245981 0.000032 IP 192.168.10.214.1234 > 192.168.10.202.37354: Flags [.], ack 7169, win 501, options [nop,nop,TS val 2940493933 ecr 3992180325], length 0
    44  6.245991 0.000010 IP 192.168.10.214.1234 > 192.168.10.202.37354: Flags [P.], seq 8689:10137, ack 7169, win 501, options [nop,nop,TS val 2940493933 ecr 3992180325], length 1448
    45  6.245995 0.000004 IP 192.168.10.202.37354 > 192.168.10.214.1234: Flags [.], ack 10137, win 501, options [nop,nop,TS val 3992180325 ecr 2940493933], length 0
    46  7.246071 1.000076 IP 192.168.10.202.37354 > 192.168.10.214.1234: Flags [P.], seq 7169:7681, ack 10137, win 501, options [nop,nop,TS val 3992181326 ecr 2940493933], length 512
    47  7.286936 0.040865 IP 192.168.10.214.1234 > 192.168.10.202.37354: Flags [.], ack 7681, win 501, options [nop,nop,TS val 2940494973 ecr 3992181326], length 0
    48  7.286941 0.000005 IP 192.168.10.202.37354 > 192.168.10.214.1234: Flags [P.], seq 7681:8193, ack 10137, win 501, options [nop,nop,TS val 3992181366 ecr 2940494973], length 512
    49  7.286973 0.000032 IP 192.168.10.214.1234 > 192.168.10.202.37354: Flags [.], ack 8193, win 501, options [nop,nop,TS val 2940494974 ecr 3992181366], length 0
    50  7.286984 0.000011 IP 192.168.10.214.1234 > 192.168.10.202.37354: Flags [P.], seq 10137:11585, ack 8193, win 501, options [nop,nop,TS val 2940494974 ecr 3992181366], length 1448
    51  7.286987 0.000003 IP 192.168.10.202.37354 > 192.168.10.214.1234: Flags [.], ack 11585, win 501, options [nop,nop,TS val 3992181366 ecr 2940494974], length 0
    52  8.287065 1.000078 IP 192.168.10.202.37354 > 192.168.10.214.1234: Flags [P.], seq 8193:8705, ack 11585, win 501, options [nop,nop,TS val 3992182367 ecr 2940494974], length 512
    53  8.327936 0.040871 IP 192.168.10.214.1234 > 192.168.10.202.37354: Flags [.], ack 8705, win 501, options [nop,nop,TS val 2940496014 ecr 3992182367], length 0
    54  8.327940 0.000004 IP 192.168.10.202.37354 > 192.168.10.214.1234: Flags [P.], seq 8705:9217, ack 11585, win 501, options [nop,nop,TS val 3992182407 ecr 2940496014], length 512
    55  8.327971 0.000031 IP 192.168.10.214.1234 > 192.168.10.202.37354: Flags [.], ack 9217, win 501, options [nop,nop,TS val 2940496015 ecr 3992182407], length 0
    56  8.327983 0.000012 IP 192.168.10.214.1234 > 192.168.10.202.37354: Flags [P.], seq 11585:13033, ack 9217, win 501, options [nop,nop,TS val 2940496015 ecr 3992182407], length 1448
    57  8.327986 0.000003 IP 192.168.10.202.37354 > 192.168.10.214.1234: Flags [.], ack 13033, win 501, options [nop,nop,TS val 3992182407 ecr 2940496015], length 0
    58  9.328064 1.000078 IP 192.168.10.202.37354 > 192.168.10.214.1234: Flags [P.], seq 9217:9729, ack 13033, win 501, options [nop,nop,TS val 3992183408 ecr 2940496015], length 512
    59  9.368935 0.040871 IP 192.168.10.214.1234 > 192.168.10.202.37354: Flags [.], ack 9729, win 501, options [nop,nop,TS val 2940497055 ecr 3992183408], length 0
    60  9.368939 0.000004 IP 192.168.10.202.37354 > 192.168.10.214.1234: Flags [P.], seq 9729:10241, ack 13033, win 501, options [nop,nop,TS val 3992183448 ecr 2940497055], length 512
    61  9.368971 0.000032 IP 192.168.10.214.1234 > 192.168.10.202.37354: Flags [.], ack 10241, win 501, options [nop,nop,TS val 2940497056 ecr 3992183448], length 0
    62  9.368985 0.000014 IP 192.168.10.214.1234 > 192.168.10.202.37354: Flags [P.], seq 13033:14481, ack 10241, win 501, options [nop,nop,TS val 2940497056 ecr 3992183448], length 1448
    63  9.368993 0.000008 IP 192.168.10.202.37354 > 192.168.10.214.1234: Flags [.], ack 14481, win 501, options [nop,nop,TS val 3992183448 ecr 2940497056], length 0
    64  10.099569 0.730576 IP 192.168.10.202.37354 > 192.168.10.214.1234: Flags [F.], seq 10241, ack 14481, win 501, options [nop,nop,TS val 3992184179 ecr 2940497056], length 0
    65  10.099658 0.000089 IP 192.168.10.214.1234 > 192.168.10.202.37354: Flags [F.], seq 14481, ack 10242, win 501, options [nop,nop,TS val 2940497786 ecr 3992184179], length 0
    66  10.099669 0.000011 IP 192.168.10.202.37354 > 192.168.10.214.1234: Flags [.], ack 14482, win 501, options [nop,nop,TS val 3992184179 ecr 2940497786], length 0
