0.000000       0 IP 127.0.0.1.33036 > 127.0.0.1.1234: Flags [S], seq 3964616781, win 65495, options [mss 65495,sackOK,TS val 3615632664 ecr 0,nop,wscale 9], length 0
0.000046      46 IP 127.0.0.1.1234 > 127.0.0.1.33036: Flags [S.], seq 3516357147, ack 3964616782, win 65483, options [mss 65495,sackOK,TS val 3615632664 ecr 3615632664,nop,wscale 9], length 0
0.000080      34 IP 127.0.0.1.33036 > 127.0.0.1.1234: Flags [.], ack 1, win 128, options [nop,nop,TS val 3615632664 ecr 3615632664], length 0
0.000134      53 client: will write header
0.000294     160 IP 127.0.0.1.33036 > 127.0.0.1.1234: Flags [P.], seq 1:513, ack 1, win 128, options [nop,nop,TS val 3615632664 ecr 3615632664], length 512
0.000315      20 IP 127.0.0.1.1234 > 127.0.0.1.33036: Flags [.], ack 513, win 127, options [nop,nop,TS val 3615632664 ecr 3615632664], length 0
0.000331      15 client: wrote header
0.000349      17 client: will write body
0.000371      22 IP 127.0.0.1.33036 > 127.0.0.1.1234: Flags [P.], seq 513:1025, ack 1, win 128, options [nop,nop,TS val 3615632664 ecr 3615632664], length 512
0.000384      12 IP 127.0.0.1.1234 > 127.0.0.1.33036: Flags [.], ack 1025, win 126, options [nop,nop,TS val 3615632664 ecr 3615632664], length 0
0.000393       9 client: wrote body
0.000406      12 client: will read reply
0.000875     469 server: pid: 52198
0.001082     206 server: (info) quickack enabled (not specified in commandline)
0.001109      27 server: read header packet
0.001119       9 server: (info) quickack enabled (not specified in commandline)
0.001134      15 server: read body packet
0.001230      95 IP 127.0.0.1.1234 > 127.0.0.1.33036: Flags [P.], seq 1:1449, ack 1025, win 128, options [nop,nop,TS val 3615632665 ecr 3615632664], length 1448
0.001278      48 IP 127.0.0.1.33036 > 127.0.0.1.1234: Flags [.], ack 1449, win 133, options [nop,nop,TS val 3615632665 ecr 3615632665], length 0
0.001300      22 server: wrote reply packet
0.001341      40 client: got reply
1.001608 1000267 client: will write header
1.001770     161 IP 127.0.0.1.33036 > 127.0.0.1.1234: Flags [P.], seq 1025:1537, ack 1449, win 133, options [nop,nop,TS val 3615633665 ecr 3615632665], length 512
1.001953     182 client: wrote header
1.002009      56 client: will write body
1.002020      10 server: read header packet
1.002035      15 client: wrote body
1.002041       5 client: will read reply
1.042962   40920 IP 127.0.0.1.1234 > 127.0.0.1.33036: Flags [.], ack 1537, win 128, options [nop,nop,TS val 3615633707 ecr 3615633665], length 0
1.043003      40 IP 127.0.0.1.33036 > 127.0.0.1.1234: Flags [P.], seq 1537:2049, ack 1449, win 133, options [nop,nop,TS val 3615633707 ecr 3615633707], length 512
1.043024      21 IP 127.0.0.1.1234 > 127.0.0.1.33036: Flags [.], ack 2049, win 127, options [nop,nop,TS val 3615633707 ecr 3615633707], length 0
1.043048      23 server: read body packet
1.043168     120 IP 127.0.0.1.1234 > 127.0.0.1.33036: Flags [P.], seq 1449:2897, ack 2049, win 128, options [nop,nop,TS val 3615633707 ecr 3615633707], length 1448
1.043203      34 IP 127.0.0.1.33036 > 127.0.0.1.1234: Flags [.], ack 2897, win 133, options [nop,nop,TS val 3615633707 ecr 3615633707], length 0
1.043219      15 server: wrote reply packet
1.043298      79 client: got reply
2.043504 1000205 client: will write header
2.043634     130 IP 127.0.0.1.33036 > 127.0.0.1.1234: Flags [P.], seq 2049:2561, ack 2897, win 133, options [nop,nop,TS val 3615634707 ecr 3615633707], length 512
2.043668      34 client: wrote header
2.043679      10 client: will write body
2.043688       9 client: wrote body
2.043697       8 client: will read reply
2.043758      60 server: read header packet
2.083855   40097 IP 127.0.0.1.1234 > 127.0.0.1.33036: Flags [.], ack 2561, win 128, options [nop,nop,TS val 3615634748 ecr 3615634707], length 0
2.083886      30 IP 127.0.0.1.33036 > 127.0.0.1.1234: Flags [P.], seq 2561:3073, ack 2897, win 133, options [nop,nop,TS val 3615634748 ecr 3615634748], length 512
2.083903      16 IP 127.0.0.1.1234 > 127.0.0.1.33036: Flags [.], ack 3073, win 127, options [nop,nop,TS val 3615634748 ecr 3615634748], length 0
2.084243     340 server: read body packet
2.084333      89 IP 127.0.0.1.1234 > 127.0.0.1.33036: Flags [P.], seq 2897:4345, ack 3073, win 128, options [nop,nop,TS val 3615634748 ecr 3615634748], length 1448
2.084362      29 IP 127.0.0.1.33036 > 127.0.0.1.1234: Flags [.], ack 4345, win 133, options [nop,nop,TS val 3615634748 ecr 3615634748], length 0
2.084376      13 server: wrote reply packet
2.084463      87 client: got reply
3.084658 1000195 client: will write header
3.084786     127 IP 127.0.0.1.33036 > 127.0.0.1.1234: Flags [P.], seq 3073:3585, ack 4345, win 133, options [nop,nop,TS val 3615635748 ecr 3615634748], length 512
3.084883      97 client: wrote header
3.084894      10 client: will write body
3.084903       9 client: wrote body
3.084909       6 client: will read reply
3.084953      44 server: read header packet
3.125950   40996 IP 127.0.0.1.1234 > 127.0.0.1.33036: Flags [.], ack 3585, win 128, options [nop,nop,TS val 3615635790 ecr 3615635748], length 0
3.125982      32 IP 127.0.0.1.33036 > 127.0.0.1.1234: Flags [P.], seq 3585:4097, ack 4345, win 133, options [nop,nop,TS val 3615635790 ecr 3615635790], length 512
3.125998      15 IP 127.0.0.1.1234 > 127.0.0.1.33036: Flags [.], ack 4097, win 127, options [nop,nop,TS val 3615635790 ecr 3615635790], length 0
3.126079      80 server: read body packet
3.126166      87 IP 127.0.0.1.1234 > 127.0.0.1.33036: Flags [P.], seq 4345:5793, ack 4097, win 128, options [nop,nop,TS val 3615635790 ecr 3615635790], length 1448
3.126190      24 IP 127.0.0.1.33036 > 127.0.0.1.1234: Flags [.], ack 5793, win 133, options [nop,nop,TS val 3615635790 ecr 3615635790], length 0
3.126204      13 server: wrote reply packet
3.126276      72 client: got reply
4.126472 1000196 client: will write header
4.126598     125 IP 127.0.0.1.33036 > 127.0.0.1.1234: Flags [P.], seq 4097:4609, ack 5793, win 133, options [nop,nop,TS val 3615636790 ecr 3615635790], length 512
4.126632      33 client: wrote header
4.126642      10 client: will write body
4.126651       9 client: wrote body
4.126659       7 client: will read reply
4.126732      73 server: read header packet
4.166935   40202 IP 127.0.0.1.1234 > 127.0.0.1.33036: Flags [.], ack 4609, win 128, options [nop,nop,TS val 3615636831 ecr 3615636790], length 0
4.166971      35 IP 127.0.0.1.33036 > 127.0.0.1.1234: Flags [P.], seq 4609:5121, ack 5793, win 133, options [nop,nop,TS val 3615636831 ecr 3615636831], length 512
4.166986      15 IP 127.0.0.1.1234 > 127.0.0.1.33036: Flags [.], ack 5121, win 127, options [nop,nop,TS val 3615636831 ecr 3615636831], length 0
4.167275     288 server: read body packet
4.167366      91 IP 127.0.0.1.1234 > 127.0.0.1.33036: Flags [P.], seq 5793:7241, ack 5121, win 128, options [nop,nop,TS val 3615636831 ecr 3615636831], length 1448
4.167390      24 IP 127.0.0.1.33036 > 127.0.0.1.1234: Flags [.], ack 7241, win 133, options [nop,nop,TS val 3615636831 ecr 3615636831], length 0
4.167404      13 server: wrote reply packet
4.167410       6 client: got reply
5.098398  930988 IP 127.0.0.1.33036 > 127.0.0.1.1234: Flags [F.], seq 5121, ack 7241, win 133, options [nop,nop,TS val 3615637762 ecr 3615636831], length 0
5.098527     129 server: read EOF
5.098867     339 IP 127.0.0.1.1234 > 127.0.0.1.33036: Flags [F.], seq 7241, ack 5122, win 128, options [nop,nop,TS val 3615637762 ecr 3615637762], length 0
5.098911      44 IP 127.0.0.1.33036 > 127.0.0.1.1234: Flags [.], ack 7242, win 133, options [nop,nop,TS val 3615637763 ecr 3615637762], length 0
