0.000000 0.000000 IP 192.168.11.202.39636 > 192.168.11.214.1234: Flags [S], seq 1156857957, win 64240, options [mss 1460,sackOK,TS val 1415968086 ecr 0,nop,wscale 7], length 0
0.000053 0.000053 IP 192.168.11.214.1234 > 192.168.11.202.39636: Flags [S.], seq 3325795374, ack 1156857958, win 65160, options [mss 1460,sackOK,TS val 2265179472 ecr 1415968086,nop,wscale 7], length 0
0.000072 0.000019 IP 192.168.11.202.39636 > 192.168.11.214.1234: Flags [.], ack 1, win 502, options [nop,nop,TS val 1415968086 ecr 2265179472], length 0
0.000085 0.000013 IP 192.168.11.202.39636 > 192.168.11.214.1234: Flags [P.], seq 1:1025, ack 1, win 502, options [nop,nop,TS val 1415968086 ecr 2265179472], length 1024
0.000120 0.000035 IP 192.168.11.214.1234 > 192.168.11.202.39636: Flags [.], ack 1025, win 502, options [nop,nop,TS val 2265179472 ecr 1415968086], length 0
0.000303 0.000183 IP 192.168.11.214.1234 > 192.168.11.202.39636: Flags [P.], seq 1:1449, ack 1025, win 502, options [nop,nop,TS val 2265179472 ecr 1415968086], length 1448
0.000308 0.000005 IP 192.168.11.202.39636 > 192.168.11.214.1234: Flags [.], ack 1449, win 501, options [nop,nop,TS val 1415968086 ecr 2265179472], length 0
1.000380 1.000072 IP 192.168.11.202.39636 > 192.168.11.214.1234: Flags [P.], seq 1025:2049, ack 1449, win 501, options [nop,nop,TS val 1415969086 ecr 2265179472], length 1024
1.000437 0.000057 IP 192.168.11.214.1234 > 192.168.11.202.39636: Flags [P.], seq 1449:2897, ack 2049, win 501, options [nop,nop,TS val 2265180473 ecr 1415969086], length 1448
1.000447 0.000010 IP 192.168.11.202.39636 > 192.168.11.214.1234: Flags [.], ack 2897, win 501, options [nop,nop,TS val 1415969087 ecr 2265180473], length 0
2.000516 1.000069 IP 192.168.11.202.39636 > 192.168.11.214.1234: Flags [P.], seq 2049:3073, ack 2897, win 501, options [nop,nop,TS val 1415970087 ecr 2265180473], length 1024
2.000569 0.000053 IP 192.168.11.214.1234 > 192.168.11.202.39636: Flags [P.], seq 2897:4345, ack 3073, win 501, options [nop,nop,TS val 2265181473 ecr 1415970087], length 1448
2.000579 0.000010 IP 192.168.11.202.39636 > 192.168.11.214.1234: Flags [.], ack 4345, win 501, options [nop,nop,TS val 1415970087 ecr 2265181473], length 0
3.000645 1.000066 IP 192.168.11.202.39636 > 192.168.11.214.1234: Flags [P.], seq 3073:4097, ack 4345, win 501, options [nop,nop,TS val 1415971087 ecr 2265181473], length 1024
3.000698 0.000053 IP 192.168.11.214.1234 > 192.168.11.202.39636: Flags [P.], seq 4345:5793, ack 4097, win 501, options [nop,nop,TS val 2265182473 ecr 1415971087], length 1448
3.000707 0.000009 IP 192.168.11.202.39636 > 192.168.11.214.1234: Flags [.], ack 5793, win 501, options [nop,nop,TS val 1415971087 ecr 2265182473], length 0
4.000775 1.000068 IP 192.168.11.202.39636 > 192.168.11.214.1234: Flags [P.], seq 4097:5121, ack 5793, win 501, options [nop,nop,TS val 1415972087 ecr 2265182473], length 1024
4.000827 0.000052 IP 192.168.11.214.1234 > 192.168.11.202.39636: Flags [P.], seq 5793:7241, ack 5121, win 501, options [nop,nop,TS val 2265183473 ecr 1415972087], length 1448
4.000835 0.000008 IP 192.168.11.202.39636 > 192.168.11.214.1234: Flags [.], ack 7241, win 501, options [nop,nop,TS val 1415972087 ecr 2265183473], length 0
5.000901 1.000066 IP 192.168.11.202.39636 > 192.168.11.214.1234: Flags [P.], seq 5121:6145, ack 7241, win 501, options [nop,nop,TS val 1415973087 ecr 2265183473], length 1024
5.000954 0.000053 IP 192.168.11.214.1234 > 192.168.11.202.39636: Flags [P.], seq 7241:8689, ack 6145, win 501, options [nop,nop,TS val 2265184473 ecr 1415973087], length 1448
5.000962 0.000008 IP 192.168.11.202.39636 > 192.168.11.214.1234: Flags [.], ack 8689, win 501, options [nop,nop,TS val 1415973087 ecr 2265184473], length 0
6.001029 1.000067 IP 192.168.11.202.39636 > 192.168.11.214.1234: Flags [P.], seq 6145:7169, ack 8689, win 501, options [nop,nop,TS val 1415974087 ecr 2265184473], length 1024
6.001080 0.000051 IP 192.168.11.214.1234 > 192.168.11.202.39636: Flags [P.], seq 8689:10137, ack 7169, win 501, options [nop,nop,TS val 2265185473 ecr 1415974087], length 1448
6.001088 0.000008 IP 192.168.11.202.39636 > 192.168.11.214.1234: Flags [.], ack 10137, win 501, options [nop,nop,TS val 1415974087 ecr 2265185473], length 0
7.001157 1.000069 IP 192.168.11.202.39636 > 192.168.11.214.1234: Flags [P.], seq 7169:8193, ack 10137, win 501, options [nop,nop,TS val 1415975087 ecr 2265185473], length 1024
7.001208 0.000051 IP 192.168.11.214.1234 > 192.168.11.202.39636: Flags [P.], seq 10137:11585, ack 8193, win 501, options [nop,nop,TS val 2265186473 ecr 1415975087], length 1448
7.001217 0.000009 IP 192.168.11.202.39636 > 192.168.11.214.1234: Flags [.], ack 11585, win 501, options [nop,nop,TS val 1415975087 ecr 2265186473], length 0
8.001283 1.000066 IP 192.168.11.202.39636 > 192.168.11.214.1234: Flags [P.], seq 8193:9217, ack 11585, win 501, options [nop,nop,TS val 1415976087 ecr 2265186473], length 1024
8.001333 0.000050 IP 192.168.11.214.1234 > 192.168.11.202.39636: Flags [P.], seq 11585:13033, ack 9217, win 501, options [nop,nop,TS val 2265187474 ecr 1415976087], length 1448
8.001341 0.000008 IP 192.168.11.202.39636 > 192.168.11.214.1234: Flags [.], ack 13033, win 501, options [nop,nop,TS val 1415976087 ecr 2265187474], length 0
9.001409 1.000068 IP 192.168.11.202.39636 > 192.168.11.214.1234: Flags [P.], seq 9217:10241, ack 13033, win 501, options [nop,nop,TS val 1415977088 ecr 2265187474], length 1024
9.001462 0.000053 IP 192.168.11.214.1234 > 192.168.11.202.39636: Flags [P.], seq 13033:14481, ack 10241, win 501, options [nop,nop,TS val 2265188474 ecr 1415977088], length 1448
9.001471 0.000009 IP 192.168.11.202.39636 > 192.168.11.214.1234: Flags [.], ack 14481, win 501, options [nop,nop,TS val 1415977088 ecr 2265188474], length 0
10.001536 1.000065 IP 192.168.11.202.39636 > 192.168.11.214.1234: Flags [P.], seq 10241:11265, ack 14481, win 501, options [nop,nop,TS val 1415978088 ecr 2265188474], length 1024
10.001585 0.000049 IP 192.168.11.214.1234 > 192.168.11.202.39636: Flags [P.], seq 14481:15929, ack 11265, win 501, options [nop,nop,TS val 2265189474 ecr 1415978088], length 1448
10.001594 0.000009 IP 192.168.11.202.39636 > 192.168.11.214.1234: Flags [.], ack 15929, win 501, options [nop,nop,TS val 1415978088 ecr 2265189474], length 0
10.099574 0.097980 IP 192.168.11.202.39636 > 192.168.11.214.1234: Flags [F.], seq 11265, ack 15929, win 501, options [nop,nop,TS val 1415978186 ecr 2265189474], length 0
10.099653 0.000079 IP 192.168.11.214.1234 > 192.168.11.202.39636: Flags [F.], seq 15929, ack 11266, win 501, options [nop,nop,TS val 2265189572 ecr 1415978186], length 0
10.099661 0.000008 IP 192.168.11.202.39636 > 192.168.11.214.1234: Flags [.], ack 15930, win 501, options [nop,nop,TS val 1415978186 ecr 2265189572], length 0
